
{
  "id": "insight_001",
  "content": "A breakthrough in quantum-enhanced solar cells could revolutionize renewable energy by achieving 95% efficiency through novel quantum dot arrangements that exploit superposition states to capture previously unusable wavelengths of light. This approach combines quantum computing principles with advanced materials science to create photovoltaic cells that operate at near-theoretical maximum efficiency.",
  "source": "research_paper",
  "timestamp": "2025-08-27T10:30:00Z",
  "metadata": {
    "priority": "high",
    "domain": "renewable_energy",
    "tags": ["quantum_computing", "solar_energy", "materials_science", "breakthrough_technology"]
  }
}
